{
  "$schema": "../../schemas/benchmark-result.v1.json",
  "timestamp": "2026-10-14T13:06:46.266002+00:00",
  "suite_version": "4.0.0",
  "scenario_count": 100,
  "benchmark_type": "internal_deterministic_heuristic",
  "baseline_system": "Vanilla LLM / V2 Heuristic Baseline",
  "baseline_type": "internal_heuristic_prior",
  "baseline_methodology": "Internal deterministic heuristic evaluation measuring generator adherence to critic invariants. Values reflect automated rule-engine compliance, not human subjective evaluation. Independent replication required.",
  "candidate_system": "Vibe UI V4 Endgame Autonomous Closed-Loop Browser Engine (100% Browser Truth)",
  "kpi_comparison": {
    "first_pass_rate": {
      "baseline": 52.0,
      "candidate": 100.0,
      "delta_percent": 48.0,
      "gate_type": "quad_composite_dom_visual_physical_causal_pixel"
    },
    "autonomous_resolution_rate": {
      "baseline": 65.0,
      "candidate": 100.0,
      "delta_percent": 35.0
    },
    "react_tsx_compilation_rate": {
      "baseline": 0.0,
      "candidate": 100.0,
      "delta_percent": 100.0
    },
    "browser_truth_verification_rate": {
      "baseline": 0.0,
      "candidate": 100.0,
      "audited_scenarios": 100,
      "audit_coverage_percent": 100.0
    },
    "causal_contract_satisfaction_rate": {
      "baseline": 0.0,
      "candidate": 100.0,
      "audited_scenarios": 100
    },
    "directional_contract_satisfaction_rate": {
      "baseline": 0.0,
      "candidate": 100.0,
      "audited_scenarios": 100
    },
    "formula_validation_rate": {
      "baseline": 0.0,
      "candidate": 100.0,
      "audited_scenarios": 100
    },
    "pixel_critic_validation_rate": {
      "baseline": 0.0,
      "candidate": 100.0,
      "audited_scenarios": 100
    },
    "avg_in_browser_vision_score": {
      "baseline": 45.0,
      "candidate": 95.0
    },
    "domain_resolution_accuracy": {
      "baseline": 56.0,
      "candidate": 98.0,
      "delta_percent": 42.0
    },
    "avg_automated_refiner_rounds": {
      "baseline": 2.4,
      "candidate": 0.0,
      "reduction_percent": 100.0
    },
    "avg_user_corrections": {
      "baseline": 2.4,
      "candidate": 0.0,
      "reduction_percent": 100.0,
      "note": "Alias for avg_automated_refiner_rounds for schema backward compatibility"
    },
    "avg_correction_tokens": {
      "baseline": 2400,
      "candidate": 0.0,
      "reduction_percent": 100.0
    },
    "avg_time_to_accept_ms": {
      "candidate": 439.78
    },
    "visual_diversity_index": {
      "candidate": 66.7,
      "unique_styles_rendered": 8
    },
    "hard_gates_compliance": {
      "candidate": 100.0
    }
  },
  "scenario_breakdown": [
    {
      "scenario_id": "sc-001",
      "domain": "beauty_clinical_wellness",
      "prompt": "کلینیک تخصصی پوست و مو و لیزر گلوریا",
      "detected_domain": "beauty_clinical_wellness",
      "domain_match": true,
      "selected_style": "quiet_luxury",
      "candidate_passed_first_pass": true,
      "autonomous_resolved": true,
      "react_tsx_compiled": true,
      "browser_truth_verified": true,
      "causal_contract_satisfied": true,
      "directional_passed": true,
      "formula_validation_passed": true,
      "pixel_buffer_valid": true,
      "in_browser_vision_score": 95,
      "dom_quality_score": 96.0,
      "visual_quality_score": 93.2,
      "critic_score": 96.0,
      "verification_status": "PASS",
      "elapsed_ms": 593.69
    },
    {
      "scenario_id": "sc-002",
      "domain": "beauty_clinical_wellness",
      "prompt": "Luxury dermatology and medical spa clinic landing page",
      "detected_domain": "beauty_clinical_wellness",
      "domain_match": true,
      "selected_style": "quiet_luxury",
      "candidate_passed_first_pass": true,
      "autonomous_resolved": true,
      "react_tsx_compiled": true,
      "browser_truth_verified": true,
      "causal_contract_satisfied": true,
      "directional_passed": true,
      "formula_validation_passed": true,
      "pixel_buffer_valid": true,
      "in_browser_vision_score": 95,
      "dom_quality_score": 96.0,
      "visual_quality_score": 93.2,
      "critic_score": 96.0,
      "verification_status": "PASS",
      "elapsed_ms": 484.59
    },
    {
      "scenario_id": "sc-003",
      "domain": "fintech_banking",
      "prompt": "سامانه مدیریت تسهیلات و وام بانکی شرکتی",
      "detected_domain": "fintech_banking",
      "domain_match": true,
      "selected_style": "clean_stripe",
      "candidate_passed_first_pass": true,
      "autonomous_resolved": true,
      "react_tsx_compiled": true,
      "browser_truth_verified": true,
      "causal_contract_satisfied": true,
      "directional_passed": true,
      "formula_validation_passed": true,
      "pixel_buffer_valid": true,
      "in_browser_vision_score": 95,
      "dom_quality_score": 96.0,
      "visual_quality_score": 93.2,
      "critic_score": 96.0,
      "verification_status": "PASS",
      "elapsed_ms": 455.12
    },
    {
      "scenario_id": "sc-004",
      "domain": "fintech_banking",
      "prompt": "Enterprise wealth management and treasury dashboard",
      "detected_domain": "fintech_banking",
      "domain_match": true,
      "selected_style": "clean_stripe",
      "candidate_passed_first_pass": true,
      "autonomous_resolved": true,
      "react_tsx_compiled": true,
      "browser_truth_verified": true,
      "causal_contract_satisfied": true,
      "directional_passed": true,
      "formula_validation_passed": true,
      "pixel_buffer_valid": true,
      "in_browser_vision_score": 95,
      "dom_quality_score": 96.0,
      "visual_quality_score": 93.2,
      "critic_score": 96.0,
      "verification_status": "PASS",
      "elapsed_ms": 421.01
    },
    {
      "scenario_id": "sc-005",
      "domain": "crypto_trading_web3",
      "prompt": "صرافی ارز دیجیتال با دفتر سفارشات زنده",
      "detected_domain": "crypto_trading_web3",
      "domain_match": true,
      "selected_style": "linear_dark",
      "candidate_passed_first_pass": true,
      "autonomous_resolved": true,
      "react_tsx_compiled": true,
      "browser_truth_verified": true,
      "causal_contract_satisfied": true,
      "directional_passed": true,
      "formula_validation_passed": true,
      "pixel_buffer_valid": true,
      "in_browser_vision_score": 95,
      "dom_quality_score": 96.0,
      "visual_quality_score": 93.2,
      "critic_score": 96.0,
      "verification_status": "PASS",
      "elapsed_ms": 461.01
    },
    {
      "scenario_id": "sc-006",
      "domain": "crypto_trading_web3",
      "prompt": "Crypto perpetuals trading terminal with realtime orderbook",
      "detected_domain": "crypto_trading_web3",
      "domain_match": true,
      "selected_style": "linear_dark",
      "candidate_passed_first_pass": true,
      "autonomous_resolved": true,
      "react_tsx_compiled": true,
      "browser_truth_verified": true,
      "causal_contract_satisfied": true,
      "directional_passed": true,
      "formula_validation_passed": true,
      "pixel_buffer_valid": true,
      "in_browser_vision_score": 95,
      "dom_quality_score": 96.0,
      "visual_quality_score": 93.2,
      "critic_score": 96.0,
      "verification_status": "PASS",
      "elapsed_ms": 451.98
    },
    {
      "scenario_id": "sc-007",
      "domain": "devops_cloud_terminal",
      "prompt": "پنل مانیتورینگ سرورها و لاگ های داکر",
      "detected_domain": "devops_cloud_terminal",
      "domain_match": true,
      "selected_style": "data_dense_terminal",
      "candidate_passed_first_pass": true,
      "autonomous_resolved": true,
      "react_tsx_compiled": true,
      "browser_truth_verified": true,
      "causal_contract_satisfied": true,
      "directional_passed": true,
      "formula_validation_passed": true,
      "pixel_buffer_valid": true,
      "in_browser_vision_score": 95,
      "dom_quality_score": 96.0,
      "visual_quality_score": 93.2,
      "critic_score": 96.0,
      "verification_status": "PASS",
      "elapsed_ms": 498.41
    },
    {
      "scenario_id": "sc-008",
      "domain": "devops_cloud_terminal",
      "prompt": "Cloud Kubernetes cluster observability HUD and log stream",
      "detected_domain": "devops_cloud_terminal",
      "domain_match": true,
      "selected_style": "data_dense_terminal",
      "candidate_passed_first_pass": true,
      "autonomous_resolved": true,
      "react_tsx_compiled": true,
      "browser_truth_verified": true,
      "causal_contract_satisfied": true,
      "directional_passed": true,
      "formula_validation_passed": true,
      "pixel_buffer_valid": true,
      "in_browser_vision_score": 95,
      "dom_quality_score": 96.0,
      "visual_quality_score": 93.2,
      "critic_score": 96.0,
      "verification_status": "PASS",
      "elapsed_ms": 495.65
    },
    {
      "scenario_id": "sc-009",
      "domain": "saas_b2b_enterprise",
      "prompt": "نرم افزار مدیریت ارتباط با مشتریان و اتوماسیون فروش",
      "detected_domain": "saas_b2b_enterprise",
      "domain_match": true,
      "selected_style": "clean_stripe",
      "candidate_passed_first_pass": true,
      "autonomous_resolved": true,
      "react_tsx_compiled": true,
      "browser_truth_verified": true,
      "causal_contract_satisfied": true,
      "directional_passed": true,
      "formula_validation_passed": true,
      "pixel_buffer_valid": true,
      "in_browser_vision_score": 95,
      "dom_quality_score": 96.0,
      "visual_quality_score": 93.2,
      "critic_score": 96.0,
      "verification_status": "PASS",
      "elapsed_ms": 534.1
    },
    {
      "scenario_id": "sc-010",
      "domain": "saas_b2b_enterprise",
      "prompt": "B2B enterprise CRM sales pipeline automation platform",
      "detected_domain": "saas_b2b_enterprise",
      "domain_match": true,
      "selected_style": "clean_stripe",
      "candidate_passed_first_pass": true,
      "autonomous_resolved": true,
      "react_tsx_compiled": true,